{
  "commercialMode": true,
  "region": "us-central1",
  "defaults": {
    "uiLocale": "en-US",
    "outputLanguagePolicy": "match_ui"
  },
  "capabilities": {
    "text_analysis": {
      "defaultModel": "gemini-3-flash-preview",
      "allowedModels": ["gemini-3-flash-preview", "gemini-2.5-flash"],
      "maxCostPerRequest": 0.05
    },
    "deep_reasoning": {
      "defaultModel": "gemini-3-pro-preview",
      "allowedModels": ["gemini-3-pro-preview", "gemini-3-flash-preview"],
      "maxCostPerRequest": 0.50
    },
    "image_generation": {
      "defaultModel": "gemini-3-pro-image-preview",
      "allowedModels": ["gemini-3-pro-image-preview", "imagen-4.0-generate-001"],
      "qualityTier": "high",
      "maxCostPerRequest": 0.10
    },
    "image_editing": {
      "defaultModel": "gemini-3-pro-image-preview",
      "allowedModels": ["gemini-3-pro-image-preview", "gemini-2.5-flash-image"],
      "maxCostPerRequest": 0.10
    }
  },
  "pricingTable": {
    "currency": "USD",
    "models": {
      "gemini-3-flash-preview": {
        "inputPricePer1M": 0.075,
        "outputPricePer1M": 0.30
      },
      "gemini-2.5-flash": {
        "inputPricePer1M": 0.075,
        "outputPricePer1M": 0.30
      },
      "gemini-3-pro-preview": {
        "inputPricePer1M": 1.25,
        "outputPricePer1M": 5.00
      },
      "gemini-3-pro-image-preview": {
        "inputPricePer1M": 1.25,
        "outputPricePer1M": 5.00,
        "perImagePrice": 0.04
      },
      "imagen-4.0-generate-001": {
        "perImagePrice": 0.04
      }
    }
  },
  "budgetGuardrails": {
    "dailyBudgetUSD": 5.00,
    "alertThresholdPercent": 80
  }
}